{
    "json-schema": [
        "/schema.json"
    ], 
    "includes": [
        "/specdoc.json"
    ], 
    "inherits": {
    }, 
    "spec": "", 
    "constraints": [
        {
            "constraint": "The key words 'MUST', 'MUST NOT', 'REQUIRED', 'SHALL', 'SHALL NOT', 'SHOULD', 'SHOULD NOT', 'RECOMMENDED',  'MAY', and  'OPTIONAL' in this spec are to be interpreted as described in RFC 2119."
        },
        {
            "constraint": "Every included specdoc MUST be valid in respect of every specified json-schema."
        }
    ], 
    "description": [
        ""
    ]
 
}